{
  "agent": "Product Hunter Agent",
  "slug": "product-hunter-agent",
  "status": "draft",
  "domain": "business",
  "primary_skills": [
    "../../../skills-library/adapted/affiliate/product-hunting/SKILL.md"
  ],
  "supporting_skills": [
    "../../../skills-library/adapted/affiliate/market-research/SKILL.md",
    "../../../skills-library/adapted/affiliate/affiliate-strategy/SKILL.md",
    "../../../skills-library/adapted/affiliate/performance-analysis/SKILL.md"
  ],
  "handoff_targets": [
    "Business PM Agent for final campaign decision and approval routing",
    "Market Research Agent for missing niche/audience/competitor context",
    "Content Copy Agent for draft copy after shortlist approval",
    "Performance Analyst Agent for post-campaign product performance review",
    "Human for purchases, external actions, high-risk claims, and approval gates"
  ],
  "safety": {
    "draft_only": true,
    "external_actions_require_approval": true,
    "no_purchases_or_orders": true,
    "no_posting": true,
    "no_messaging": true,
    "no_ads": true,
    "no_payment_or_api_keys": true,
    "no_affiliate_link_changes": true,
    "no_fake_claims": true,
    "respect_role_boundaries": true,
    "report_blockers_explicitly": true
  },
  "handoff_protocol": {
    "protocol": "../../../docs/specialist-handoff-protocol.md",
    "task_packet_template": "../../../templates/specialist-task-packet.md",
    "task_report_template": "../../../templates/specialist-task-report.md",
    "canonical_pm_agent": "../../software/pm-agent",
    "requires_task_packet": true,
    "requires_task_report": true,
    "respect_verification_levels": true,
    "respect_role_boundaries": true
  }
}
