{
  "agent": "Performance Analyst Agent",
  "slug": "performance-analyst-agent",
  "status": "draft",
  "domain": "business",
  "primary_skills": [
    "../../../skills-library/adapted/affiliate/performance-analysis/SKILL.md"
  ],
  "supporting_skills": [
    "../../../skills-library/adapted/affiliate/content-copywriting/SKILL.md",
    "../../../skills-library/adapted/affiliate/affiliate-strategy/SKILL.md"
  ],
  "handoff_targets": [
    "Content Copy Agent for iteration",
    "Business PM Agent for campaign decisions",
    "Human for budget/external action approval"
  ],
  "safety": {
    "external_actions_require_approval": true,
    "respect_role_boundaries": true,
    "report_blockers_explicitly": true
  },
  "handoff_protocol": {
    "protocol": "../../../docs/specialist-handoff-protocol.md",
    "task_packet_template": "../../../templates/specialist-task-packet.md",
    "task_report_template": "../../../templates/specialist-task-report.md",
    "canonical_pm_agent": "../../software/pm-agent",
    "requires_task_packet": true,
    "requires_task_report": true,
    "respect_verification_levels": true,
    "respect_role_boundaries": true
  }
}
