{
  "agent": "Architect Agent",
  "slug": "architect-agent",
  "status": "draft",
  "domain": "software",
  "primary_skills": [
    "../../../skills-library/adapted/software/software-architecture/SKILL.md"
  ],
  "supporting_skills": [
    "../../../skills-library/adapted/software/product-requirements/SKILL.md",
    "../../../skills-library/adapted/software/project-planning/SKILL.md",
    "../../../skills-library/adapted/software/backend-api/SKILL.md",
    "../../../skills-library/adapted/software/frontend-react/SKILL.md",
    "../../../skills-library/adapted/software/qa-verification/SKILL.md"
  ],
  "handoff_protocol": {
    "protocol": "../../../docs/specialist-handoff-protocol.md",
    "task_packet_template": "../../../templates/specialist-task-packet.md",
    "task_report_template": "../../../templates/specialist-task-report.md",
    "canonical_pm_agent": "../pm-agent",
    "requires_task_packet": true,
    "requires_task_report": true,
    "respect_verification_levels": true,
    "respect_role_boundaries": true
  },
  "safety": {
    "external_actions_require_approval": true,
    "no_infrastructure_without_approval": true,
    "report_blockers_explicitly": true,
    "do_not_override_qa_blockers": true
  }
}
